tool_id,name,url,organisations,partners,developers,donors,typologies,keywords,descriptions,countries,spatial_scale,frequncies,users,contacts
375 TTI,Swiss Platform for Sustainable Cocoa,https://www.kakaoplattform.ch/,,,,,Other - initiative/organisation,Cocoa,,Global,,,,
376 TTI,The Aichi Biodiversity Targets and Business,https://www.cbd.int/business/projects/aichibus.shtml,Convention on Biological Diversity (CBD),,,,Other - Initiative/Organisation; Digital reports,,,global,,,,
377 TTI,The Amsterdam Declarations,https://ad-partnership.org/,Mekon Ecology,,,,Other - initiative/organisation,,,Europe,,,,
378 TTI,The Global Green Finance Index,https://www.longfinance.net/programmes/financial-centre-futures/global-green-finance-index/,Deliver; Finance Watch; Long Finance,,,,Data services; Digital reports,,,Global,,,,
379 TTI,The Global Landscapes Forum (GLF),https://www.globallandscapesforum.org/,Center for International Forestry Research (CIFOR); UNEP; World Bank,,,,Other - initiative/organisation,,,Global,,,,
380 TTI,The Global Trade Analysis Project (GTAP),https://www.gtap.agecon.purdue.edu/,Center for Global Trade Analysis in Purdue University's Department of Agricultural Economics,,,,Database; Model; Digital reports; Data portal,Environment,,Global,,,,
381 TTI,The Good Growth Partnership (The Green Commodities Programme),https://www.greencommodities.org/content/gcp/en/home.html,UNDP,,,,Other - initiative/organisation; Decision-support tool; Digital reports,Soy; Beef; Palm oil,,Brazil; Paraguay; Indonesia; Liberia,,,,
382 TTI,The Land Use Dialogue (LUD),https://theforestsdialogue.org/,The Forests Dialogue (TFD),,,,Other - initiative/organisation,Forests,,Ghana; New Haven; Uganda; Democratic Republic of Congo; Brazil; Tanzania,,,,
383 TTI,The Madingley Model. General Ecosystem Model (GEM),https://journals.plos.org/plosbiology/article?id=10.1371/journal.pbio.1001841,UNEP-WCMC; UCLK; Imperial College; University of Copenhagen; Cambridge University; Stockholm Resilience Centre; Radbound University; ZSL; Nereus Program; Northern Arizona University.,,,,Model,Environment; Agriculture,,Global,,,,
384 TTI,The Soy Toolkit,https://www.proforest.net/en/programmes/latin-america/soy-toolkit,Proforest,,,,Data portal,Environment; Social; Soya,,,,,,
385 TTI,The Sustainable Agriculture Initiative Platform (SAI Platform),https://saiplatform.org/,Danone; Nestlé; Unilever,,,,Other - initiative/organisation; Digital reports,,,Global,,,,
386 TTI,Trade and Sustainable Development (TSD),https://ec.europa.eu/transparency/expert-groups-register/screen/expert-groups/consult?do=groupDetail.groupDetail&groupID=3013,European Commission,,,,Other - initiative/organisation,,,,,,,
387 TTI,Transforming Business Practices,https://www.nature.org/en-us/about-us/who-we-are/how-we-work/working-with-companies/transforming-business-practices/,The Nature Conservancy,,,,Other - initiative/organisation,Sustainable Agriculture,,Global,,,,
388 TTI,Trends in Ecosystem Services (TeSE) business initiative,https://eaesp.fgv.br/en/producao-intelectual/ecosystem-services-related-business-cases-trends-ecosystem-services-tese,Centre for Sustainability Studies of Sao Paulo Business Administration School at Getulio Vargas Foundation (FGVces/EAESP-FGV),,,,Other - Initiative/Organisation; Digital reports,,,Brazil,,,,
389 TTI,Tropical Forest Alliance (TFA) 2020,https://www.weforum.org/projects/tfa-2020,Tropical Forest Alliance (TFA) 2020,,,,Other - initiative/organisation; Data portal,Palm oil; Soy; Beef; Paper; Pulp,,"Latin America, Africa, Southeast Asia",,,,
390 TTI,Tropical Landscapes Finance Facility,https://www.tlffindonesia.org/,Ministry for Economic Affairs Republic of Indonesia,,,,Other - Initiative/Organisation,,,Indonesia,,,,
391 TTI,UK Global Resource Initiative (GRI),https://assets.publishing.service.gov.uk/government/uploads/system/uploads/attachment_data/file/881395/global-resource-initiative.pdf,UK Government; DEFRA,,,,Other - Initiative/Organisation; Digital reports,,,Global; UK,,,,
392 TTI,UK Roundtable on Sustainable Soy,https://www.efeca.com/the-uk-roundtable-on-sustainable-soya/,UK Government,,,,Other - Initiative/Organisation; Digital reports,Soya,,Global,,,,
393 TTI,UNBiodiversity Lab,https://unbiodiversitylab.org/,UNDP; UN Environment; GEF; CBD,,,,Decision-support tool; Data portal,Environment,,Global,,,,
394 TTI,Understanding Deforestation-Free (UDF),https://theforestsdialogue.org/initiative/understanding-deforestation-free-udf,The Forests Dialogue,,,,Other - initiative/organisation,Forests,,Indonesia; West/Central Africa,,,,
395 TTI,UTZ Certified,https://www.rainforest-alliance.org/utz/,Rainforest Alliance,,,,Other - initiative/organisation,Environment; Social; Coffee; Cocoa,,"Members from Brazil, Cameroon, China, Democratic Republic of Congo, Indonesia, Tanzania",,,,
396 TTI,WE MEAN BUSINESS,https://www.wemeanbusinesscoalition.org/,,,,,Other - initiative/organisation,,,Global,,,,
397 TTI,Working Group on Sustainable Trade Finance,https://iccwbo.org/publication/sustainable-trade-criteria-customer-due-diligence-guidelines/,International Chamber of Commerce (ICC) Banking Commission,,,,Other - initiative/organisation,,,Global,,,,
398 TTI,World Input-Output Tables and underlying data (WIOD),http://www.wiod.org/gvc,European Commission,,,,Database,Environment,,Global,,,,
399 TTI,WWF/IFC Commodities BMP Initiative,https://pubs.iied.org/sites/default/files/pdfs/migrate/G00186.pdf,IFC,,,,Other - Initiative/Organisation; Digital reports,Sugarcane; Cotton; Soybeans; Oil palm,,,,,,
199,Earth Time,https://earthtime.org/,"The Community Robotics, Education and Technology Empowerment Lab (CREATE Lab)",,,,Flexible analysis platform,Earth observation,"EarthTime enables users to interact with visualizations of the Earth's transformation over time. Combining huge data sets with images captured by NASA satellites between 1984 and 2016, EarthTime brings to life patterns of natural change and human impact.",Global,Global,,,
201,Global Forest Watch Pro,https://pro.globalforestwatch.org/about,Global Forest Watch and World Resources Institutes's,,,,Flexible analysis platform,Earth observation,"Global Forest Watch Pro (GFW Pro) is an online management application to support reducing deforestation in commodity supply chains. GFW Pro delivers critical decision-making analysis at the property, supply shed and portfolio levels. The platform also empowers users, from commodity field officers to financial Chief Risk Officers, to manage and monitor changes in deforestation risk. The application is built upon best-in-class, timely data from the Global Forest Watch Partnership and World Resources Institute’s scientific research.",Global,Global; Regional; National; Local,,,
204,IDH the Sustainable Trade Initiative,https://www.idhsustainabletrade.com/impact/mitigation-of-deforestation/,IDH,,,,Other - initiative/organisation,Palm oil; Cocoa; Soy,"IDH brings together the sourcing commitments of companies, the jurisdictional power of governments, and the knowledge and networks of local Civil Society Organizations (CSOs) to develop strategies which encourage forest protection in supply chains. Thereby reducing encroachment on new forest areas and forest degradation.",Indonesia; Brazil,Not applicable,,,
205,IKnowFood,https://iknowfood.org/about-us/,"University of York, the Universities of Liverpool, Manchester",,,,Flexible analysis platform,Agriculture,Interdisciplinary multi-stakeholder approach to developing a unifying understanding of ‘food system resilience’ using tools and methods to integrate the knowledge and perspectives of hitherto disparate food system actors.,United Kingdom,National,,,
206,INBAR International Network for Bamboo and Rattan,https://www.inbar.int/about-inbar/#1,,,,,Flexible analysis platform,Bamboo; Rattan,"The International Bamboo and Rattan Organisation (INBAR) is a multilateral development organisation that promotes environmentally sustainable development using bamboo and rattan. It supports SDG 1, 17, 7, 11, 12, 13, 15",,Global; Regional; National,,,
207,Innovative Farmers,https://www.innovativefarmers.org/about/,"Waitrose DUCHY Organic, Soil Association, The prince of Wales Charitable Fund, Organic Research Centre ELM Farm, Innovation for Agriculture, LEAF",,,,Other - initiative/organisation,Sustainable business; Agriculture,"Through the network, groups of farmers can work directly with a researcher to design ‘field lab’s: on farm trials that can be set up quickly and are highly practical. The group decides on the topic and the researcher helps design a trial. Field labs can be on any issue that makes farm businesses more sustainable and resilient. Right now, there are over 50 field labs on topics including herbal leys, potato blight and mineral deficiencies in calves.",United Kingdom,National,,,
208,IOTA Ecosystem,https://ecosystem.iota.org/,IOTA Foundation,,,,Flexible analysis platform,,"Platform for community to meet, collaborate, learn, inspire, develop and build. The platform donates to developers that get new innovation and ideas off the ground. The Foundation funds new innovation from developers considered beneficial for the overall IOTA ecosystem. Ideas can be from proof-of-concepts to utilities, libraries, and more. Everyone who requires financial support in the broader IOTA developer community can be encouraged to develop, collaborate, learn, inspire and build for the greater good.",,Global,,,
209,Life Cycle Initiative,https://www.lifecycleinitiative.org/about/about-lci/,UN Environment,,,,Flexible analysis platform,,"The Life Cycle Initiative is a public-private, multi-stakeholder partnership enabling the global use of credible life cycle knowledge by private and public decision maker. It provides a global forum to ensure a science-based, consensus-building process to support decisions and policies towards the shared vision of sustainability as a public good.",,Global,,,
210,Linking Environment and Farming (LEAF),https://leafuk.org/about-leaf/what-we-do,,,,,Flexible analysis platform,Agriculture,"LEAF work wih farmers, food industry, scientists and consumers, to inspire and enable sustainable farming that is prosperous, enriches the environment and engages local communities.",United Kingdom,National,,,
211,N8AgriFood,https://www.n8agrifood.ac.uk/,"University of Durham, Lancaster, Leeds, Liverpool, Manchester, Newcastle, Sheffield and York.",,,,Flexible analysis platform,agriculture,"N8 AgriFood is a unique programme working across the entire food system to ensure sustainable, resilient and healthy food supplies for all.",,Global,,,
212,Safe Trace,https://www.agrotransparencia.com.br/homeenglish,"PWC, The nature Conservancy, CPQD, Sebrae, ApexBRasil",,,,Flexible analysis platform,Cotton; Coffee; Beef; Sugar; Soy; Cocoa; Palm oil; Tea; Dairy; Textiles; Gold; Aquaculture,"Safe Trace company is specialized in the traceability of food production chain, integrating information from all links, from the producer to the consumer's plate. It ensure transparency that the producer is acting according to socio-environmental and sanitary standards.",,,,,
214,Solidaridad Network,https://www.solidaridadnetwork.org/,,,,,Flexible analysis platform,,"Solidaridad’s global network worked with over 632,000 farmers, miners and workers to adopt good practices. Solidaridad Network also helped to improve the income of 235,000 producers by engaging stakeholders within 334 projects.",,Global; Regional; National,,,
215,Supply Chain Transparency Network,https://www.gc-dz.com/exec?m=sctndd&u=auto_login__sctn,Global Canopy Programme; SEI,,,,Flexible analysis platform,,"The network focuses on efforts to map, monitor and gather data on key forest risk commodity supply chains, and how to best leverage this information to support a transition to a more sustainable global economy.",,Global,,,
216,Sustainable and Healthy Food Systems (SHEFS),https://shefsglobal.lshtm.ac.uk/,"The Food Foundation, London School of Hygiene $ Tropical Medicine, City University of London, RVC, SOAS, Centre for Chronic Disease Control, UCL, University of Aberdeen, University of Kwazulu-Natal, ATREE",,,,Flexible analysis platform,agriculture,"The focus for SHEFS is on bridging the gap between science and practice to understand and solve current social and environmental problems. The project unites partners in different countries to work closely together and share methods, data, knowledge and expertise from a wide range of sources.","United Kingdom, South Africa, India",National,,,
217,Switch Med,https://www.switchmed.eu/en,"UNIDO, UNEP, UNEP/MAP, Regional Activity Centre for Sustainable Consumption and Production,",,,,Other - initiative/organisation,,"The SWITCH-Med Policy component aims at strengthening relevant environmental governance and policy frameworks. With broad stakeholder participation, it will develop/refine national SCP policy action plans in the beneficiary countries and develop a regional SCP action plan and roadmap under the Barcelona Convention",Mediterranean,Regional,,,
218,The International Panel of Experts on Sustainable Food Systems (IPES-Food),http://www.ipes-food.org/about/,,,,,Other - initiative/organisation,Agriculture,IPES-Food is an independent panel of experts with a mission to promote transition to sustainable food systems around the world.,Europe; West Africa,Regional,,,
219,The Socially and Environmentally Sustainable Oil Palm Reserarch Sensor Project (SENSOR),http://www.sensorproject.net/,South East Asia Rainforest Research Partnership (SEARRP),,,,Other - initiative/organisation,Sustainable business; Palm oil,"The Socially and Environmentally Sustainable Oil Palm Research (SEnSOR) programme is testing the impact of the Roundtable on Sustainable palm Oil (RSPO): the major certification standard for sustainable palm oil. The SEnSOR programme is investigating sustainability in three main areas: Biodiversity, Environment (including soil, water and greenhouse gases) and Society (including community and labour rights, and livelihoods)",,Global,,,
220,Sedex,https://www.sedexglobal.com/about-us/,,,,,Flexible analysis platform,Agriculture,Based on supply chain integrity organisation,,Global,,,
221,World Benchmarking Alliance,https://www.worldbenchmarkingalliance.org/about-us/,,,,,Flexible analysis platform,Agriculture,"Benchmarking organisation looking to benchmark companies against the SDGs. Focusing on food, agriculture and seafood. Benchmark currently being developed. Funded by Aviva and UN Foundations plus various governments.",,Global,,,
222,The Organisation for Economic Co-operation and Development,https://www.oecd.org/about/,,,,,Other - initiative/organisation,,"The Organisation for Economic Co-operation and Development (OECD) is an international organisation that works with policy makers, citizen and governments establishing international norms and finding evidence-based solutions to a range of social, economic and environmental challenges.",,Global,,,
224,Sustainable Natural Rubber Initiative (SNR-i),http://snr-i.org/,,,,,Other - initiative/organisation,Rubber,The International Rubber Study Group (IRSG) is an inter-governmental organisation composed of rubber producing and consuming stakeholders. The Sustainable Natural Rubber Initiative (SNR-i) has been developed under the framework of the IRSG as a voluntary and collaborative industry project to ensure that the rubber industry can build on its best practices plus demonstrate and communicate throughout the natural rubber value chain,,Global,,,
225,"Forest, Trees and Agroforestry (FTA)",http://www.foreststreesagroforestry.org/what-is-fta/,Center for International Forestry Research (CGIAR),"Bioversity International, CATIE, CIRAD, the International Network for Bamboo and Rattan, Tropenbos International, and the World Agroforestry",,,Data source; Other - initiative/organisation,Agriculture,"FTA is the only CGIAR research program that works on all aspects of the value and benefits of trees and forests for agricultural landscapes and sustainability as linked to agricultural development.FTA addresses challenges from landscapes to livelihoods by developing, providing and promoting evidence-based solutions for farmers, foresters, practicioners, value-chain actors and policy makers. FTA complements the other CGIAR agri-food programs focused on specific crops and commodities, and contributes to CGIAR’s integrative programs for policies, institutions and markets, nutrition and health, ecosystem services and climate change",,Global,,,
226,Saving Tomorrow’s Agriculture Resources (STAR) Program,https://starfreetool.com/about,Champaign County Soil and Water Conservation District,,,,Flexible analysis platform,Agriculture,"S.T.A.R. is a FREE statewide tool to assist farm operators and land owners in evaluating their nutrient and soil loss management practices on individual fields. The S.T.A.R. program encourages farmers and landowners to use management practices and decisions that will reduce the nutrient and soil losses on their fields, and in return, they are provided recognition with a field sign recognizing their level of commitment to conservation. Ultimately, this program will help reduce the nutrient and soil losses from farmland over larger areas, and specifically the various water sheds, while engaging key stakeholders from all corners of the ag sector - retail, commodity, agency, and farmers.",USA,National,,,
227,AGWater Challenge,https://www.ceres.org/sites/default/files/files/AWC%20Criteria%20-%202018.pdf,"Ceres, WWF",,,,Flexible analysis platform,Agriculture,"The AgWater Challenge helps companies advance their sustainable sourcing strategies. Participating companies receive support in analyzing water issues within their supply chains, and in refining or making new sourcing commitments that enable them to better address their risk.",,Global,,,
228,Global Landscapes forum (GLF),https://www.globallandscapesforum.org/,"Center for International Forestry Research (CIFOR), in collaboration with its co-founders UN Environment and the World Bank and Charter Members",,,,Flexible analysis platform,Agriculture,"GLF is the world’s largest knowledge-led platform on integrated land use, dedicated to achieving the Sustainable Development Goals and Paris Climate Agreement. The Forum takes a holistic approach to create sustainable landscapes that are productive, prosperous, equitable and resilient and considers five cohesive themes of food and livelihood initiatives, landscape restoration, rights, finance and measuring progress.",,Global,,,
229,Sustainable Rice Platform (SRP),http://www.sustainablerice.org/,UN Environment and International Rice Research Institute (IRRI),,,,Other - initiative/organisation,Sustainable business; Rice,"SRP is a multi-stakeholder platform to promote resource efficiency and sustainability in trade flows, production and consumption operations, and supply chains in the global rice sector. The SRP pursues public policy development and voluntary market transformation initiatives to provide private, non-profit and public actors in the global rice sector with sustainable production standards and outreach mechanisms that contribute to increasing the global supply of affordable rice, improved livelihoods for rice producers and reduced environmental impact of rice production",,Global,,,
230,High Conservation Values Resource Network (HCV),https://hcvnetwork.org/,"World Resources Institute, Forest People Programme, WWF, mondi, Olam, gar, FSC, Proforest, RSPO,",,,,Other - initiative/organisation,Agriculture,"The HCV Network is a member-based organisation that strives to protect High Conservation Values in areas where the expansion of forestry and agriculture may put important forests, biodiversity and local communities at risk.",,Global,,,
231,Ceres,https://www.ceres.org/index.php/about-us,,,,,Other - initiative/organisation,Finance; Sustainable business,"Ceres is a sustainability non-profit organization working with the most influential investors and companies to build leadership and drive solutions throughout the economy. Through powerful networks and advocacy, Ceres tackles the world’s biggest sustainability challenges, including climate change, water scarcity and pollution, and inequitable workplaces.",,,,,
232,Business for Water Stewardship Network,https://businessforwater.org/about,Bonneville Environmental Foundation,,,,Other - initiative/organisation,Sustainable business,"Business for Water Stewardship, a program of the Bonneville Environmental Foundation, helps businesses across the US advance solutions to ensure communities, economies and ecosystems have enough clean water to flourish.",USA,National,,,
233,IRIS+,https://iris.thegiin.org/standards/,Global Impact Investing Network,,,,Decision-support tool,Finance; Agriculture,"IRIS+ is the generally accepted impact accounting system that leading impact investors use to measure, manage, and optimize their impact. Proper use of the IRIS+ system ensures a minimum level of consistency in a users’ impact claims and performance, which makes it easier for investors to analyze and extract useful information for decision making.",,Global,,,
234,LBG Framework,http://www.lbg-online.net/about/,Corporate Citizenship,,,,Flexible analysis platform,Sustainable business; Finance,The LBG Framework is a robust measurement standard that any company can apply to understand the difference their contributions make to business and society.,,Global,,,
235,Association for Supply Chain Management,http://www.apics.org/about/overview,Association for Supply Chain Management,,,,Flexible analysis platform,Sustainable business,"The Association for Supply Chain Management (ASCM) is the global leader in supply chain organizational transformation, innovation and leadership.",,Global,,,
236,B Impact Assessment,https://bimpactassessment.net/node/464,B Lab,,,,Other - initiative/organisation,,"Platform providing standards, points of reference and tools.",,Global,,,
237,Access to Nutrition Foundation (ATNF),https://accesstonutrition.org/about-us/,,,,,Other - initiative/organisation,,Independent non-profit organization based in the Netherlands dedicated to objectively assessing and improving the contribution the private sector makes to addressing global nutrition challenges. The Foundation hosts the Access to Nutrition Index.,,Global,,,
238,Sustainability Accounting Standards Board (SASB),https://www.sasb.org/standards-overview/materiality-map/,Sustainability Accounting Standards Board,,,,Decision-support tool,Natural capital / ecosystem services; Finance,"SASB standards enable businesses around the world to identify, manage and communicate financially-material sustainability information to their investors.",,Global,,,
239,Sopact,https://www.sopact.com/,"Social Value International, Impact Management PRoject, UN Sustainable Development Goals, GIIN, Feedback Labs",,,,Flexible analysis platform,,Social Impact Measurement & Impact Management software platform.,,Global,,,
240,Global Innovation Exchange (GIE),https://www.globalinnovationexchange.org/about,,,,,Flexible analysis platform,,"GIE is a global development technology platform for innovations, funding and insights",,Global,,,
241,Sustainable Coffee Challenge,https://www.sustaincoffee.org/about/,,,,,Flexible analysis platform,Sustainable business; Coffee,"The Sustainable Coffee Challenge is a collaborative effort of companies, governments, NGOs, research institutions and others to transition the coffee sector to be fully sustainable",,Global,,,
243,World Cocoa Foundation,https://www.worldcocoafoundation.org/,,,,,Flexible analysis platform,Sustainable business; Cocoa,"The World Cocoa Foundation (WCF) is a non-profit international membership organization whose vision is a sustainable and thriving cocoa sector – where farmers prosper, cocoa-growing communities are empowered, human rights are respected, and the environment is conserved.",,Global,,,
244,Alliance for Zero Extinction (AZE),https://zeroextinction.org/the-alliance/partner-list/,"GEF, UNEP, American Bird Conservancy, Birdlife Internation, IUCN",,,,Other - initiative/organisation,,"Joint initiative of biodiversity conservation organizations from around the world to prevent extinctions by identifying and safeguarding key sites, which are the last remaining refuges of one or more Endangered or Critically Endangered species.",,Global,,,
245,THESIS,https://www.sustainabilityconsortium.org/what-we-offer/thesis/,The Sustainability Consortium (TSC),,,,Flexible analysis platform,,"Transform the consumer goods industry through multi-stakeholder collaboration, empowering members to make sustainability improvements at scale in global supply chains. Using a science-based approach, they work with corporate, civil society, and government stakeholders to identify hotspots, improvement opportunities, and key performance indicators for different types of consumer products. The system is science-based and stakeholder reviewed in order to be practical and actionable.",,Global,,,
246,Evidensia,https://www.evidensia.eco/how-to-use-evidensia/why-evidensia/,"ISEAL Alliance, Rainforest Alliance, WWF",,,,Decision-support tool,,"Access to research on the sustainability impacts of supply chain initiatives and tools, including standards and certification",,Global,,,
247,The Global Value Toolkit,https://www.global-value.eu/toolkit/,"Institute for Managing Sustainability, Vienna University of Economics & Business",,,European Union FP7,Data portal,,"The GLOBAL VALUE toolkit provides knowledge, tools and resources for companies and other societal actors wishing to tackle the Sustainable Development Goals (SDGs) together with business. in this space with the newest resources, events and innovations on how companies can better measure and manage their contribution to the achievement of the SDGs.",,Global,,,
