tool_id,name,url,organisations,partners,developers,donors,typologies,keywords,descriptions,countries,spatial_scale,frequncies,users,contacts
244 TTI,Biodiversity Barometer,http://www.biodiversitybarometer.org/,Union for Ethical BioTrade (UEBT),,,,Other - initiative/organisation; Digital reports,Cosmetics; Pharmaceuticals,,Global,,,,
245 TTI,Biodiversity Footprint Calculator (BF),http://www.plansup.nl/cms/wp-content/uploads/Factsheet-Bf-Calculator.pdf,Plansup,,,,Decision-support tool,Environment; Agriculture,,Global,,,,
246 TTI,Biodiversity Footprint for Financial Institutions (BFFI),https://pre-sustainability.com/solutions/consulting/sustainable-companies/biodiversity-assessment/,ASN Bank,,,,Decision-support tool,Environment; Financial; Agriculture,,Global,,,,
247 TTI,Biodiversity Impact Metric (BIM) or Healthy Ecosystems Metrics,https://www.cisl.cam.ac.uk/resources/publication-pdfs/healthy-ecosystem-metric-framework.pdf,Cambridge Institute for Sustainability Leadership (CISL),,,,Decision-support tool,Environment; Agriculture,,Global,,,,
248 TTI,Biodiversity Indicator for Extractive Companies (BIE),https://www.unep-wcmc.org/system/dataset_file_fields/files/000/000/487/original/Biodiversity_Indicators_for_Extractive_Companies_FINAL.pdf?1516357616,UNEP-WCMC; Fauna & Flora International; Conservation International,,,,Decision-support tool,Environment; Extractive Industries,,Global,,,,
249 TTI,Biodiversity Monitoring System for the Food Sector and Biodiversity Performance Tool (BPT),https://www.business-biodiversity.eu/en/biodiversity-performance-tool,Solagro; France. Lake Constance Foundation; Germany,,,,Decision-support tool,Environment; Agriculture,,Global,,,,
250 TTI,Biological Diversity Protocol (BD Protocol),http://bdprotocol.org/,Endangered Wildlife Trust (Sout Africa),,,,Decision-support tool,Environment; Agriculture,,Global,,,,
251 TTI,Bioscope,https://www.i-care-consult.com/wp-content/uploads/2018/09/Assessment-biodiversity-metrics-for-business-and-FI_draft-report-5Sept2018.pdf,Platform BEE (Biodiversity; Ecosystems and Economy),,,,Decision-support tool,Environment; Agriculture,,Global,,,,
252 TTI,Brazilian Roundtable on Sustainable Livestock (GTPS),https://gtps.org.br/en/,,,,,Other - initiative/organisation,Livestock,,Brazil,,,,
253 TTI,Building productive and sustainable landscapes and livelihoods,https://www.wbcsd.org/Programs/Food-and-Nature/Food-Land-Use/Global-Agribusiness-Action-on-Equitable-Livelihoods,Global Agri Business Alliance,,,,Other - initiative/organisation; Data portal,Agriculture,,Global,,,,
254 TTI,Bushmeat Crisis Task Force (BCTF),https://www.povertyandconservation.info/en/org/o0163,,,,,Other - Initiative/Organisation,Bushmeat,,Global,,,,
255 TTI,Bushmeat Research Initiative,https://www2.cifor.org/bushmeat/,CIFOR,,,,Other - Initiative/Organisation,Bushmeat,,Global,,,,
256 TTI,Business and Biodiversity Offsets Programme (BBOP),https://www.forest-trends.org/bbop/,Forest Trends,,,,Other - initiative/organisation,,,Global,,,,
257 TTI,Business for Nature,https://www.businessfornature.org/,WBCSD; WE MEAN BUSINESS; World Economic Forum; Natural Capital Coalition; WWF; The Nature Conservancy; ICC; WRI; IUCN,,,,Other - initiative/organisation,Nature,,Global,,,,
258 TTI,Business for Sustainable Landscapes,https://portals.iucn.org/library/sites/library/files/documents/2017-022.pdf,Landscapes for People; Food and Nature Initiative,,,,Other - initiative/organisation; Digital reports,Food; Agriculture,,Global,,,,
259 TTI,Center for Environmental Leadership in Business,https://celb.org/,CELB,,,,Other - initiative/organisation,,,,,,,
260 TTI,CGF resolution to zero net deforestation by 2020,https://www.theconsumergoodsforum.com/environmental-sustainability/forest-positive/,The Consumer Goods Forum (CGF),,,,Other - initiative/organisation; Data portal,Soy; Palm oil; Paper; Pulp; Cattle,,Global,,,,
261 TTI,Cocoa & Forests Initiative,https://www.worldcocoafoundation.org/initiative/cocoa-forests-initiative/,World Cocoa Foundation (WCF),,,,Other - initiative/organisation,Cocoa,,Colombia; Côte d’Ivoire; Ghana,,,,
262 TTI,CocoaAction,"https://www.worldcocoafoundation.org/initiative/cocoaaction/#:~:text=CocoaAction%20was%20a%20voluntary%20strategy,The%20program%20ended%20in%202019.",WCF,,,,Other - initiative/organisation,Cocoa,,Global,,,,
263 TTI,Commodities and Sustainable Development,https://unctad.org/topic/commodities,UNCTAD,,,,Other - initiative/organisation; Digital reports; Other - Statistics,,,,,,,
264 TTI,Corporate Ecosystem Services Review (ESR),https://www.wri.org/research/corporate-ecosystem-services-review,WRI,,,,Other - initiative/organisation,,,Global,,,,
265 TTI,Council for Sustainable Business,https://www.gov.uk/government/groups/council-for-sustainable-business,UK Department for Environment; Food and Rural Affairs,,,,Other - Initiative/Organisation,,,,,,,
266 TTI,CPIC’s Forest Landscape Conservation and Restoration Working Group,"http://cpicfinance.com/blueprints/forest-restoration-and-conservation/#:~:text=CPIC's%20Forest%20Landscape%20Conservation%20and,carbon%20credits%20and%20usage%20fees.&text=The%20working%20group%20is%20led,European%20Investment%20Bank%20(EIB).",Coalition for Private Investment in Conservation (CPIC),,,,Other - initiative/organisation; Data services,Timber,,global,,,,
267 TTI,CPIC’s Sustainable Agricultural Intensification Working Group,http://cpicfinance.com/blueprints/sustainable-agricultural-intensification/,Coalition for Private Investment in Conservation (CPIC),,,,Other - initiative/organisation,,,global,,,,
268 TTI,CREEA (Compiling and Refining Environmental and Economic Accounts ),https://cordis.europa.eu/project/id/265134/reporting,TNO,,,,Other - initiative/organisation; Digital reports,Environment,,Global,,,,
269 TTI,CRIC (Corporate Responsibility Interface Center),https://cric-online.org/,,,,,Other - initiative/organisation,Investment,,Global,,,,
270 TTI,Capitals Coalition,https://capitalscoalition.org/,,,,,Other - initiative/organisation; Digital reports,Environment,,Global,,,,
271 TTI,Dialecte,http://dialecte.solagro.org/index.php,Solagro,,,,Decision-support tool,Environment; Agriculture,,,,,,
272 TTI,EcoInvent,https://www.ecoinvent.org/about/about.html,ETH; Agroscope; Empa; EPFL; PSI,,,,Database,Agriculture,,Global,,,,
273 TTI,Encouraging responsible investment,https://www.worldwildlife.org/industries/international-finance,WWF,,,,Decision-support tool,Soy,,Global,,,,
274 TTI,Environmental Impact Index (EII),https://spillovers.environmentalimpact.global/#/,Sustainable Development Solutions Network (SDSN); Yale Center for Environmental Law & Policy (YCELP),,,,Decision-support tool,Environment,,Global,,,,
275 TTI,Environmental Profit & Loss Account (EP&L),https://www.kering.com/en/sustainability/environmental-profit-loss/,Kering,,,,Decision-support tool,Environment; Luxury,,Global,,,,
276 TTI,EORA,https://www.worldmrio.com/,,,,,Database,Environment,,Global,,,,
277 TTI,Equator Principles (EP) - Biodiversity Working Group,https://equator-principles.com/working-groups/,Citi; CIFI,,,,Other - Initiative/Organisation,,,Global,,,,
278 TTI,EU Product Environmental Footprints,https://ec.europa.eu/environment/eussd/smgp/ef_pilots.htm#sme,,,,,Decision-support tool,Environment; Agriculture,,Europe,,,,
279 TTI,EX- Ante Carbon balance Tool (EX-ACT),http://www.fao.org/tc/exact/ex-act-home/en/,FAO; AFD,,,,Decision-support tool,Environment; Agriculture,,Global,,,,
280 TTI,EXIOBASE,https://www.exiobase.eu/,NTNU; TNO; SERI; Universiteit Leiden; WU; 2.-0 LCA Consultants,,,,Database,Environment; Agriculture,,Global,,,,
281 TTI,Facilitation of Financing for Biodiversity-based Businesses and Support of Market Development Activities in the Andean Region,https://www.thegef.org/project/facilitation-financing-biodiversity-based-businesses-and-support-market-development,Global Environment Facility (GEF) Trust Fund,,,,Other - initiative/organisation,,,Andean region,,,,
282 TTI,Fair for Life (FFL) / For Life (FL),https://www.fairforlife.org/pmws/indexDOM.php?client_id=fairforlife&page_id=materials&lang_iso639=en,ECOCERT Group,,,,Other - initiative/organisation,Environment; Social,,Global,,,,
283 TTI,Fairtrade International,https://www.fairtrade.net/,Fairtrade International,,,,Other - initiative/organisation,Environment; Social,,Global,,,,
284 TTI,FEW-View,https://fewsion.dtn.asu.edu/,Fewsion; National Science Foundation; USDA; NAU; ASU,,,,Visualisation / dashboard,Environment,,,,,,
285 TTI,Financial Sector Engagement initiative,https://www.tropicalforestalliance.org/,Tropical Forest Alliance (TFA) 2020,,,,Other - initiative/organisation; Data portal,Palm oil; Soy; Beef; Paper; Pulp,,Global,,,,
286 TTI,FNG (Forum Nachhaltige Geldanlagen),https://www.forum-ng.org/en/,,,,,Other - initiative/organisation,,,Global,,,,
287 TTI,Forest 500,https://forest500.org/,Global Canopy,,,,Visualisation / dashboard; Data portal,Forests,,Tropics,,,,
288 TTI,Forest Code Thermometer,https://observatorioflorestal.org.br/en/termometro-do-codigo-florestal-coloca-a-transparencia-nas-maos-do-cidadao/,Forest Code Observatory (OCF),,,,Decision-support tool; Data portal; Other - Software,Environment; App,,Brazil,,,,
289 TTI,"Forest Law Enforcement, Governance and Trade Action Plan (FLEGT)",https://www.euflegt.efi.int/home,European Union,,,,Other - initiative/organisation; Digital reports,Timber,,,,,,
290 TTI,CDP Forests Program,https://www.cdp.net/en/forests,CDP,,,,Data source; Data portal,Forests,,Global,,,,
291 TTI,Frankfurt Declaration,https://www.cms.int/en/document/frankfurt-declaration,CMS,,,,Other - initiative/organisation,,,,,,,
292 TTI,Future Earth,https://futureearth.org/networks/knowledge-action-networks/,,,,,Other - initiative/organisation,Environment; Social,,Global,,,,
293 TTI,General Agreement on Tariffs and Trade (GATT-Article VI) General Agreement on Trade in Services (GATS – Article VI),https://www.wto.org/english/docs_e/legal_e/26-gats_01_e.htm,World Trade Organization (WTO),,,,Other - initiative/organisation,,,,,,,
294 TTI,German Initiative on Sustainable Cocoa (GISCO),https://www.kakaoforum.de/en/,BMZ; BMEL,,,,Other - initiative/organisation,Cocoa,,Global,,,,
295 TTI,Global Biodiversity Information Facility (GBIF),https://www.gbif.org/,,,,,Data Portal; Flexible analysis platform; Visualisation / dashboard; Model,,,,,,,
296 TTI,Global Biodiversity Score (GBS),GBS Technical update March 2019,CDC biodiversite,,,,Decision-support tool,Environment; Agriculture,,Global,,,,
297 TTI,"Global BioTrade Programme - Linking trade, biodiversity and sustainable development",https://unctad.org/project/global-biotrade-facilitation-programme-linking-trade-biodiversity-and-sustainable,UNCTAD,,,,Other - initiative/organisation; Digital reports,,,Global,,,,
298 TTI,Global Commission on Adaptation,https://gca.org/about-us/the-global-commission-on-adaptation/,,,,,Other - initiative/organisation; Digital reports,,,,,,,
299 TTI,Global Green Growth Institute (GGGI),https://gggi.org/,,,,,Other - initiative/organisation,Environment; Social,,Global,,,,
300 TTI,Global Impacts Platform,https://www.isealalliance.org/sites/default/files/resource/2018-05/Global%20Impacts%20Platform%20RFP%20Submission%20Deadline%20Extended.pdf,ISEAL Alliance,,,,Other - Initiative/Organisation; Database; Digital reports,,,Global,,,,
301 TTI,Global Partnership for Business and Biodiversity,https://www.cbd.int/business/gp.shtml,Convention on Biological Diversity (CBD),,,,Other - initiative/organisation,,,global,,,,
302 TTI,Global Roundtable for Sustainable Beef (GRSB),https://grsbeef.org/,,,,,Other - initiative/organisation,Environment; Social; Beef,,Brazil; China,,,,
303 TTI,Global Thinkers Forum (GTF),https://www.globalthinkersforum.org/,Oxford University’s Said Business School,,,,Other - initiative/organisation,Social,,Global,,,,
304 TTI,Global Trade Finance Program (GTFP),https://www.ifc.org/wps/wcm/connect/industry_ext_content/ifc_external_corporate_site/financial+institutions/priorities/global+trade/gtfp,International Finance Corporation (IFC),,,,Other - Initiative/Organisation,,,Global,,,,
305 TTI,GMAP,https://gmaptool.org/,IFC,,,,Visualisation / dashboard,Agro-commodity,,Global,,,,
306 TTI,"Governing global value chains to protect local environments - Cocoa and Biodiversity""",https://www.iddri.org/en/initiative/governing-global-value-chains-protect-local-environments,IDDRI,,,,Other - initiative/organisation,Cocoa; Palm oil; Fisheries,,Global,,,,
307 TTI,Green and Sustainable Finance Cluster Germany,https://gsfc-germany.com/en/,Green Finance Cluster of the Hessian Ministry of Economic Affairs,,,,Other - initiative/organisation,,,Global,,,,
308 TTI,Green Bond Principles,https://www.icmagroup.org/sustainable-finance/the-principles-guidelines-and-handbooks/green-bond-principles-gbp/,International Capital Market Association’s (ICMA),,,,Other - Initiative/Organisation,,,Global,,,,
309 TTI,Green Finance Taskforce,https://www.gov.uk/government/publications/accelerating-green-finance-green-finance-taskforce-report,Green Finance Institute; UK Government,,,,Other - Initiative/Organisation; Digital reports,,,UK,,,,
310 TTI,Halotrade,https://halotrade.io/,Founder Shona Tatchell,,,,Data services,,,Global,,,,
311 TTI,Harmonized Environmental Storage and Tracking of the Impacts of Agriculture (HESTIA initiative),https://www.oxfordmartin.ox.ac.uk/food-sustainability-analytics/,University of Oxford,,,,Data portal,Environment; Agriculture,,Global,,,,
312 TTI,Healthy Forests programme,https://www.earthworm.org/uploads/files/HFL-Approach-paper.pdf,TFT/ Earthworm,,,,Other - initiative/organisation,Apparel; Aquaculture; Coffee; Cocoa; Cotton; Fresh; Ingredients; Palm oil; Pulp; Paper; Soy; Tea; Timber; Cassava,,Global,,,,
313 TTI,High Carbon Stock Approach (HCSA),http://highcarbonstock.org/,,,,,Decision-support tool; Other - initiative/organisation,Forests,,Global,,,,
314 TTI,Horizon Committee,https://saiplatform.org/our-work/news/horizon-committee-cultivates-soil-resource-centre/,The Sustainable Agriculture Initiative Platform (SAI Platform),,,,Other - initiative/organisation,Agriculture; Soil,,Global,,,,
315 TTI,New Trade Agenda,http://www.foeeurope.org/new-trade-agenda,Friends of the Earth,,,,Digital reports,,,,,,,
316 TTI,Telecoupling Toolbox,https://telecouplingtoolbox.org/,Michigan State University,,,,Other - software; Flexible analysis platform,,,,,,,
317 TTI,Hub for Sustainable Finance (H4SF),https://www.nachhaltigkeitsrat.de/en/projects/hub-for-sustainable-finance-h4sf/,German Council for Sustainable Development,,,,Other - Initiative/Organisation,,,,,,,
318 TTI,IBM (Blockchain and supply chain research),https://www.ibm.com/blockchain/supply-chain,IBM,,,,Data services,Environment,,Global,,,,
319 TTI,Impact Builder,https://www.bond.org.uk/resources/impact-builder,Bond,,,,Visualisation / dashboard,Environment; Social,,Global,,,,
320 TTI,Integrated Biodiversity Assessment Tool – IBAT,https://www.ibat-alliance.org/,Birdlife; IUCN; UNEP-WCMC,,,,Decision-support tool,,,global,,,,
321 TTI,Integrated Landscape Management,https://www.fao.org/land-water/overview/integrated-landscape-management/fr/,,,,,Other - initiative/organisation,,,Asia; Latin America; Africa,,,,
322 TTI,International Network of Financial Centres for Sustainability,https://www.fc4s.org/,UNEP,,,,Other - initiative/organisation,,,Global,,,,
323 TTI,InVEST (Integrated Valuation of Ecosystem Services and Trade-offs),https://ecosystemsknowledge.net/invest,The Natural Capital Project; Stanford University; WWF; The Nature Conservancy; the Institute on the Environment at University of Minnesota.,,,,Model,Environment,,Global,,,,
324 TTI,Investor Initiative for Sustainable Forests (IISF),https://www.ceres.org/sites/default/files/Fact%20Sheets%20or%20misc%20files/IISF%20One-Pager%20PDF.pdf,CERES,,,,Other - initiative/organisation,Cattle; Soy,,Global,,,,
325 TTI,JNCC/Route2 Indicator Project,http://randd.defra.gov.uk/Document.aspx?Document=15028_2018-19-PilotingIndicatorsfortheGlobalEnvironmentalImpactsofUKConsumption.pdf,JNCC,,,,Digital reports,Environment; Agriculture,,Global,,,,
326 TTI,Landscale,https://www.landscale.org/,Rainforest Alliance; Verra; CCBA; Ecoagriculture Partners; IUCN; NCRC; Proforest,,,,Decision-support tool,Environment; Social; Agriculture,,Global,,,,
327 TTI,"Landscapes for People, Food and Nature Initiative (LPFN)",https://peoplefoodandnature.org/,WRI; UNEP; TWB; FAO,,,,Other - initiative/organisation; Decision-support tool; Digital reports,Food; Agriculture,,,,,,
328 TTI,LC-IMPACT,https://lc-impact.eu/,NTNU; PRE; RU; ETH; DTU,,,,Decision-support tool,Environment; Social; Agriculture,,Global,,,,
329 TTI,Learning Hub for Business in Landscapes,https://sustainablefoodlab.org/initiatives/landscapes-initiative/,Sustainable Food Lab; WBCSD; IDH; The Forests Dialogue (TFD),,,,Other - Initiative/Organisation,Smallholders; Cocoa; Coffee; Vanilla; Corn; Soybean; Wheat,,Global,,,,
330 TTI,LIFE Impact Index,https://www.i-care-consult.com/wp-content/uploads/2018/09/Assessment-biodiversity-metrics-for-business-and-FI_draft-report-5Sept2018.pdf,LIFE Institute,,,,Decision-support tool,Environment; Agriculture,,Global,,,,
331 TTI,Living Planet Index (Farmland specialist),https://www.bipindicators.net/indicators/living-planet-index/living-planet-index-farmland-specialists,WWF; ZSL,,,,Decision-support tool,Environment,,Global,,,,
332 TTI,Living Planet Index (LPR),http://www.livingplanetindex.org/home/index,WWF; ZSL,,,,Decision-support tool,Environment; Agriculture,,Global,,,,
333 TTI,Map Hubs,https://www.maphubs.com/,,,,,Data services; Flexible analysis platform,Environment; Agriculture,,Global,,,,
334 TTI,Map of Life (MOL),https://mol.org/indicators/coverage,Group on Earth Observations; Biodiversity Observation Network,,,,Flexible analysis platform; Data portal; Visualisation / dashboard,Environment,,Global,,,,
335 TTI,Maplecroft,https://www.maplecroft.com/,Verisk,,,,Data services,Environment; Social,,Global,,,,
336 TTI,Natural Capital Coalition / Protocol,https://www.iucn.org/theme/business-and-biodiversity/our-work/business-platforms/natural-capital-coalition,CISL; CCI; FFI; UNEP WCMC; RSPB; BirdLife,,,,Other - initiative/organisation; Digital reports,Natural Capital,,Global,,,,
337 TTI,Natural Infrastructure for Business,https://www.naturalinfrastructureforbusiness.org/wp-content/uploads/2017/05/Incentives_for_Natural_Infrastructure.pdf,WBCSD; CH2M; TNC,,,,Other - initiative/organisation,,,Global,,,,
338 TTI,Naturemap,https://naturemap.earth/faq/,IIASA; IIS; UNEP-WCMC; Sustainable Development Solutions Network,,,,Visualisation / dashboard,Environment,,Global,,,,
339 TTI,New York Declaration on Forests (NYDF) Global Platform,https://forestdeclaration.org/about/nydf-global-platform/,UNDP; German Government; Meridian Institute,,,,Other - Initiative/Organisation,Forests,,Global,,,,
340 TTI,One Planet Business for Biodiversity (OP2B),https://op2b.org/,World Business Council for Sustainable Development (WBCSD),,,,Other - initiative/organisation,Environment; Agriculture,,,,,,
341 TTI,One Planet Network,https://www.oneplanetnetwork.org/,WBCSD,,,,Other - initiative/organisation; Database,,,,,,,
342 TTI,OpenSC,https://opensc.org/vision.html,WWF Australia,,,,Other - software; Flexible analysis platform,,,Global,,,,
343 TTI,Palm Oil Buyers Scorecard,https://palmoilscorecard.panda.org/#/home,WWF,,,,Decision-support tool,Environment; Palm oil,,Europe,,,,
344 TTI,PLAN B,https://bteam.org/,THE B TEAM,,,,Other - initiative/organisation,,,Global,,,,
345 TTI,Poverty Footprint,https://www-cdn.oxfam.org/s3fs-public/file_attachments/oxfam-poverty-footprint_3.pdf,OXFAM,,,,Decision-support tool,Social; Agriculture,,Global,,,,
346 TTI,Poverty Probability Index (PPI),https://www.povertyindex.org/,,,,,Decision-support tool,Social,,,,,,
347 TTI,Principles for Leadership in Sustainable Purchasing,https://www.sustainablepurchasing.org/principles-for-leadership-in-sustainable-purchasing/,Sustainable Purchasing Leadership Council (SPLC),,,,Other - initiative/organisation,,,Global,,,,
348 TTI,Producer Support Estimates (PSE),https://www.oecd-ilibrary.org/agriculture-and-food/agricultural-policy-monitoring-and-evaluation-2018_agr_pol-2018-en,Organisation for Economic Cooperation and Development (OECD),,,,Database,Environment; Agriculture,,Global,,,,
349 TTI,Product Biodiversity Footprint (PBF),http://www.productbiodiversityfootprint.com/,I Care Consultants; Sayari,,,,Decision-support tool,Environment; Agriculture,,Global,,,,
350 TTI,Product Social Impact Assessment The Roundtable for Product Social Metrics,https://product-social-impact-assessment.com/,PRe Sustainability,,,,Other - initiative/organisation,Social,,Global,,,,
351 TTI,Roundtable on responsible Soy (RTRS),https://responsiblesoy.org/?lang=en,,,,,Other - initiative/organisation; Decision-support tool; Data services,Environment; Social; Soy,,Global,,,,
352 TTI,Roundtable on Sustainable Biomaterials (RSB),https://rsb.org/,,,,,Other - initiative/organisation; Digital reports; Decision-support tool,Soy; Rapeseed; Mustard seed; Palm; Sugar cane; Sugar beets; Corn; Cassava; Sorghum; Wheat.,,Global,,,,
353 TTI,RSPO convened Biodiversity & High Conservation Values Working Group (BHCVWG),https://rspo.org/resources/supporting-bodies-sc-wg-tf-/working-groups/biodiversity-and-high-conservation-values-working-group-bhcvwg-,Round table on sustainable palm oil (RSPO),,,,Other - Initiative/Organisation; Digital reports,Palm oil,,Malaysia; Thailand; Indonesia,,,,
354 TTI,RSPO Financial Institutions Task Force (FITF),https://rspo.org/library/lib_files/download/818,RSPO,,,,Other - Initiative/Organisation,Palm oil,,Global,,,,
355 TTI,RSPO PalmTrace,https://rspo.org/palmtrace,UTZ,,,,Other - initiative/organisation; Decision-support tool,Palm oil,,Global,,,,
356 TTI,Satelligence,https://satelligence.com/,Cirad; World Resources Institute; NASA; esa; TuDelft; Grameen foundation; Wageningen,,,,Data source; Decision-support tool,Environment,,Global,,,,
357 TTI,SCP hotspot Analysis,http://scp-hat.lifecycleinitiative.org/,Life Cycle Initiative; One Planet; International Resource Panel,,,,Decision-support tool,Environment; Social,,Global,,,,
358 TTI,Símbolo de Pequeños Productores/ Small Producers Symbol (SPP),https://spp.coop/small-producers-symbol/,,,,,Other - initiative/organisation,Social; Agricultural; Beekeeping,,"Latin America, Caribbean, Africa and Asia, including only developing countries",,,,
359 TTI,Sistema de Monitoramento di Fazenda (SIMFAZ),https://simfaz.agrosatelite.com.br/,,,,,Data services; Decision-support tool,Environment; Social; Agriculture,,Brazil,,,,
360 TTI,Soft Commodities Compact,https://www.cisl.cam.ac.uk/centres/centre-for-sustainable-finance/soft-commodities,CGF-BEI/CISL,,,,Other - initiative/organisation,Soy; Palm oil; Beef; Paper; Pulp; Timber,,Global,,,,
361 TTI,Soft Commodities Forum (SCF),https://www.wbcsd.org/Programs/Food-and-Nature/Food-Land-Use/Soft-Commodities-Forum,WBCSD,,,,Other - initiative/organisation,Soy,,Brazil,,,,
362 TTI,SourceMap,https://sourcemap.com/,SourceMap,,,,Other - initiative/organisation; Decision-support tool; Visualisation / dashboard; Data services,,,Global,,,,
363 TTI,Soy Buyers Coalition,https://www.theconsumergoodsforum.com/news_updates/the-cgf-and-its-members-launch-soy-buyers-coalition/,The Consumer Goods Forum (CGF),,,,Other - initiative/organisation,Soy,,Brazil,,,,
364 TTI,Soy Scorecard 2016,https://wwf.panda.org/wwf_news/?269750/Soy-Scorecard-2016,WWF,,,,Decision-support tool,Environment; Soy,,Europe,,,,
365 TTI,Species Threat Abatement and Recovery (STAR). Previus name: Biodiversity Return on Investment Metric (BRIM),https://www.iucn.org/regions/washington-dc-office/our-work/species-threat-abatement-and-recovery-star-metric,IUCN,,,,Decision-support tool,Environment; Agriculture,,Global,,,,
366 TTI,Sustainability Policy Transparency Toolkit (SPOTT),https://www.spott.org/,ZSL,,,,Decision-support tool; Other - Initiative/Organisation; Digital reports; Data services,Palm oil; Rubber,,Global,,,,
367 TTI,Starling verification,https://www.starling-verification.com/,Airbus; TFT,,,,Data services,Palm oil,,Global,,,,
368 TTI,Supply Change,https://www.supplychange.co.uk/,Forest Trends,,,,Decision-support tool; Data services,Forests,,Global,,,,
369 TTI,Sustainability of Supply Chain Partners in Developing Countries,https://www.sustainablefoodtrade.org/working-groups/sustainability-of-supply-chain-partners-in-developing-countries/,Sustainable Food Trade Association (SFTA),,,,Other - Initiative/Organisation; Digital reports,,,,,,,
370 TTI,Sustainable Agriculture Network,https://www.sustainableagriculture.eco/,,,,,Other - initiative/organisation; Digital reports,Crops,,Global,,,,
371 TTI,Sustainable Agriculture Network/Rainforest Alliance (SAN/RA) certification scheme,https://www.rainforest-alliance.org/why-certification/,Rainforest Alliance,,,,Other - initiative/organisation,Environment; Social; Agriculture,,Global,,,,
372 TTI,Sustainable Commodities Project and Framework,https://sustainabilityconsortium.org/project/sustainable-commodities-project-and-framework/,The Sustainability Consortium (TSC),,,,Digital reports,"Corn; Cotton; Palm oil; Rice; Soy; 
 wheat.",,Global,,,,
373 TTI,Sustainable Supply Chain Initiative (SSCI),https://www.theconsumergoodsforum.com/social-sustainability/sustainable-supply-chain-initiative/,The Consumer Goods Forum (CGF),,,,Other - initiative/organisation,,,Global,,,,
374 TTI,Sustainable Trade Finance Council,https://www.cisl.cam.ac.uk/business-action/sustainable-finance/banking-environment-initiative/programme/restore-nature/sustainable-trade-finance,Banking Environment Initiative (BEI); CISL,,,,Other - initiative/organisation,Soft commodities,,Global,,,,
